### ISSUE TITLE
hikaricp doesn't evict connection after receiving RST 

### ISSUE THREAD

**Issue by phantomedc** [brettwooldridge/HikariCP#1759]
```shell
09:50:05.888833 IP 10-177-123-159.58148 > 10.52.61.220.33066: Flags [S], seq 3693926659, win 62780, options [mss 1460,nop,nop,sackOK,nop,wscale 11], length 0
09:50:05.889062 IP 10.52.61.220.33066 > 10-177-123-159.58148: Flags [S.], seq 2834164214, ack 3693926660, win 62780, options [mss 1452,nop,wscale 11], length 0
09:50:05.889091 IP 10-177-123-159.58148 > 10.52.61.220.33066: Flags [.], ack 1, win 31, length 0
09:50:05.889401 IP 10.52.61.220.33066 > 10-177-123-159.58148: Flags [P.], seq 1:86, ack 1, win 31, length 85
09:50:05.889415 IP 10-177-123-159.58148 > 10.52.61.220.33066: Flags [.], ack 86, win 31, length 0
09:50:05.889747 IP 10-177-123-159.58148 > 10.52.61.220.33066: Flags [P.], seq 1:223, ack 86, win 31, length 222
09:50:05.889869 IP 10.52.61.220.33066 > 10-177-123-159.58148: Flags [.], ack 223, win 32, length 0
09:50:05.889941 IP 10.52.61.220.33066 > 10-177-123-159.58148: Flags [P.], seq 86:97, ack 223, win 32, length 11
09:50:05.890085 IP 10-177-123-159.58148 > 10.52.61.220.33066: Flags [P.], seq 223:1208, ack 97, win 31, length 985
09:50:05.890460 IP 10.52.61.220.33066 > 10-177-123-159.58148: Flags [P.], seq 97:1167, ack 1208, win 33, length 1070
09:50:05.890761 IP 10-177-123-159.58148 > 10.52.61.220.33066: Flags [P.], seq 1208:1226, ack 1167, win 32, length 18
09:50:05.890915 IP 10.52.61.220.33066 > 10-177-123-159.58148: Flags [P.], seq 1167:1463, ack 1226, win 33, length 296
09:50:05.891248 IP 10-177-123-159.58148 > 10.52.61.220.33066: Flags [P.], seq 1226:1248, ack 1463, win 33, length 22
09:50:05.891381 IP 10.52.61.220.33066 > 10-177-123-159.58148: Flags [P.], seq 1463:1474, ack 1248, win 33, length 11
09:50:05.891437 IP 10-177-123-159.58148 > 10.52.61.220.33066: Flags [P.], seq 1248:1285, ack 1474, win 33, length 37
09:50:05.891574 IP 10.52.61.220.33066 > 10-177-123-159.58148: Flags [P.], seq 1474:1485, ack 1285, win 33, length 11
09:50:05.891650 IP 10-177-123-159.58148 > 10.52.61.220.33066: Flags [P.], seq 1285:1306, ack 1485, win 33, length 21
09:50:05.891818 IP 10.52.61.220.33066 > 10-177-123-159.58148: Flags [P.], seq 1485:1496, ack 1306, win 33, length 11
09:50:05.892020 IP 10-177-123-159.58148 > 10.52.61.220.33066: Flags [P.], seq 1306:1368, ack 1496, win 33, length 62
09:50:05.892254 IP 10.52.61.220.33066 > 10-177-123-159.58148: Flags [P.], seq 1496:1507, ack 1368, win 33, length 11
09:50:05.892332 IP 10-177-123-159.58148 > 10.52.61.220.33066: Flags [P.], seq 1368:1386, ack 1507, win 33, length 18
09:50:05.892635 IP 10.52.61.220.33066 > 10-177-123-159.58148: Flags [P.], seq 1507:1802, ack 1386, win 33, length 295
09:50:05.892936 IP 10-177-123-159.58148 > 10.52.61.220.33066: Flags [P.], seq 1386:1429, ack 1802, win 34, length 43
09:50:05.893202 IP 10.52.61.220.33066 > 10-177-123-159.58148: Flags [P.], seq 1802:1881, ack 1429, win 33, length 79
09:50:05.894368 IP 10-177-123-159.58152 > 10.52.61.220.33066: Flags [S], seq 1648835486, win 62780, options [mss 1460,nop,nop,sackOK,nop,wscale 11], length 0
09:50:05.894533 IP 10.52.61.220.33066 > 10-177-123-159.58148、58152: Flags [S.], seq 2771672160, ack 1648835487, win 62780, options [mss 1452,nop,wscale 11], length 0
09:50:05.933171 IP 10-177-123-159.58148 > 10.52.61.220.33066: Flags [.], ack 1881, win 34, length 0

#after being idle for 5 minutes, server sent RST to hikariCP
09:55:06.945007 IP 10.52.61.220.33066 > 10-177-123-159.58148: Flags [R], seq 0, win 0, length 0

#the next request come, hikaricp still used this connection and doesn't receive any response from server,this  caused application timeout
09:56:31.288061 IP 10-177-123-159.58148 > 10.52.61.220.33066: Flags [P.], seq 1429:1442, ack 1881, win 34, length 13
09:56:31.488172 IP 10-177-123-159.58148 > 10.52.61.220.33066: Flags [P.], seq 1429:1442, ack 1881, win 34, length 13
09:56:31.892167 IP 10-177-123-159.58148 > 10.52.61.220.33066: Flags [P.], seq 1429:1442, ack 1881, win 34, length 13
09:56:32.698173 IP 10-177-123-159.58148 > 10.52.61.220.33066: Flags [P.], seq 1429:1442, ack 1881, win 34, length 13
09:56:34.313167 IP 10-177-123-159.58148 > 10.52.61.220.33066: Flags [P.], seq 1429:1442, ack 1881, win 34, length 13
#sent FIN and evicted this connection
09:56:36.293431 IP 10-177-123-159.58148 > 10.52.61.220.33066: Flags [F.], seq 1442, ack 1881, win 34, length 0
09:56:37.537179 IP 10-177-123-159.58148 > 10.52.61.220.33066: Flags [FP.], seq 1429:1442, ack 1881, win 34, length 13
```

i konw i should set ```maxLifeTime``` lower than mysql server, but i think connection pool should handle RST flag

**Comment by brettwooldridge** [comment]
@phantomedc What you discussing, a TCP RST, is occurring at a level *far* below HikariCP.  The first layer would be the TCP stack, next would be Java, next would be the JDBC driver, and finally HikariCP.  I have no idea why RST would not cause TCP/Java to immediately mark the socket as closed.  If it is marked closed, and HikariCP executes an *alive* test, then it *should* fail immediately.

**Comment by Chris2018998** [comment]
Hi @phantomedc,

Very interesting test. Can you help test [BeeCP](https://github.com/Chris2018998/BeeCP) with same way? thanks.
